{
  "schema_version": "visual_motion_analysis.v0",
  "analysis_run_id": "vismot_run_rr003_smile_001",
  "scenario_id": "rr003.visible_motion.smile.no_live.v0",
  "proof_layer": "no_live_runtime",
  "motion_event_id": "mot_evt_rr003_smile_001",
  "stimulus_instance_id": "mot_inst_rr003_smile_001",
  "driver_result_id": "mot_drv_rr003_smile_001",
  "mixer_tick_ids": [
    "mot_tick_rr003_smile_001"
  ],
  "source_ref": {
    "kind": "synthetic_test_frames",
    "source_ref_id": "redacted_synthetic_smile_001",
    "raw_source_shared": false
  },
  "sampling": {
    "sample_rate_fps": 8,
    "evaluation_window_ms": 6000,
    "frame_count": 48
  },
  "windows": [
    {
      "window_id": "active",
      "start_ms": 500,
      "end_ms": 2500
    },
    {
      "window_id": "release",
      "start_ms": 2500,
      "end_ms": 4000
    },
    {
      "window_id": "settle",
      "start_ms": 4000,
      "end_ms": 6000
    }
  ],
  "roi_config": {
    "viewport": {
      "width": 1920,
      "height": 1080
    },
    "rois": [
      {
        "roi_id": "avatar_face_head",
        "kind": "avatar",
        "counts_as_avatar_motion": true,
        "expected_for_pass": true,
        "rect_norm": {
          "x": 0.44,
          "y": 0.08,
          "w": 0.20,
          "h": 0.28
        }
      },
      {
        "roi_id": "speech_bubble",
        "kind": "guard_ui",
        "counts_as_avatar_motion": false,
        "expected_for_pass": false,
        "rect_norm": {
          "x": 0.20,
          "y": 0.32,
          "w": 0.34,
          "h": 0.22
        }
      },
      {
        "roi_id": "input_bar",
        "kind": "guard_ui",
        "counts_as_avatar_motion": false,
        "expected_for_pass": false,
        "rect_norm": {
          "x": 0.06,
          "y": 0.90,
          "w": 0.88,
          "h": 0.08
        }
      }
    ]
  },
  "thresholds": {
    "active_motion_min_score": 0.12,
    "settle_motion_max_score": 0.05,
    "min_consecutive_samples": 2
  },
  "result": "visual-pass",
  "roi_results": [
    {
      "roi_id": "avatar_face_head",
      "kind": "avatar",
      "counts_as_avatar_motion": true,
      "pretrigger_peak_motion_score": 0.02,
      "active_peak_motion_score": 0.34,
      "release_peak_motion_score": 0.11,
      "settle_peak_motion_score": 0.03,
      "pass_label": "visual-motion-detected"
    },
    {
      "roi_id": "speech_bubble",
      "kind": "guard_ui",
      "counts_as_avatar_motion": false,
      "pretrigger_peak_motion_score": 0.01,
      "active_peak_motion_score": 0.28,
      "release_peak_motion_score": 0.04,
      "settle_peak_motion_score": 0.02,
      "pass_label": "guard-ui-motion-excluded"
    }
  ],
  "artifact_policy": {
    "raw_frames_shared": false,
    "raw_paths_shared": false,
    "chart_shared": false,
    "cleanup_note_required": true
  },
  "redaction": {
    "redaction_status": "summary_only",
    "shareability_class": "review_packet",
    "public_safe": false
  },
  "safety": {
    "raw_prompt_shared": false,
    "raw_transcript_shared": false,
    "raw_log_shared": false,
    "raw_media_shared": false,
    "raw_path_shared": false,
    "raw_asset_filename_shared": false,
    "provider_payload_shared": false,
    "private_endpoint_shared": false,
    "home_assistant_route_retained": false
  }
}
